Likes,Comments,Shares,Content,Audio URL,Transcription,English,
43.2K,36,4.1K,poster,https://cdn4.sharechat.com/33d5318_26f/audio/1d020a87_1731655401965.mp3?tenant=moj&referrer=audio-service&f=33d5318_26f/audio/1d020a87_1731655401965.mp3," पापा की परी नहीं बनना है, ना बनना है मुरैले की मोरनी, अबे उत्तर प्रदेश की लड़की है, अपने पापा की शेरनी","Papa is not to become an angel, neither to become a corecas, Abe is a girl from Uttar Pradesh","Papa is not to become an angel, neither to become a corecas, Abe is a girl from Uttar Pradesh"
74.3K,111,6.6K,poster,https://cdn4.sharechat.com/33d5318_26f/audio/280f7885_1732786057614.mp3?tenant=moj&referrer=audio-service&f=33d5318_26f/audio/280f7885_1732786057614.mp3, हमने जिसे चाहा उसने चाहा किसी और को खुदा करे जिसे वो चाहें वो भी चाहें किसी और को तेरी,"Whatever we wanted, he wanted someone else to God, whatever he wants, he will also want someone else","Whatever we wanted, he wanted someone else to God, whatever he wants, he will also want someone else"
9K,11,3.1K,❤❤❤❤❤❤❤❤ #TaubaTauba #MeraRangDeBasantiChola #DekhaTenu #TarasNiAayaTujhko #Zaalimaa,https://cdn4.sharechat.com/33d5318_26f/audio/164e0849_1730377481310.mp3?tenant=moj&referrer=audio-service&f=33d5318_26f/audio/164e0849_1730377481310.mp3, पदमों में तेरे मैं दो जहां वाले हूँ चैन मेरा ले लो खुशी मेरी ले लो,"In the Padams, I have my two, take peace, take me, take me happiness","In the Padams, I have my two, take peace, take me, take me happiness"
136.9K,46,9K,poster,https://cdn4.sharechat.com/33d5318_26f/audio/2fcac728_1730572848120.mp3?tenant=moj&referrer=audio-service&f=33d5318_26f/audio/2fcac728_1730572848120.mp3, दिखने वालों ने क्या क्या नहीं देखा होगा मेरा दावा है कि तुझे दिखने वालों ने क्या क्या नहीं देखा होगा,"What did not see what you have seen, I claim what you have not seen","What did not see what you have seen, I claim what you have not seen"
224K,191,15K,poster,https://cdn4.sharechat.com/33d5318_26f/audio/15700524_1730159551152.mp3?tenant=moj&referrer=audio-service&f=33d5318_26f/audio/15700524_1730159551152.mp3, बिकते नहीं यहां दिल ये इश्क की है मैफिल लगाओ ये फरेब की दुकान और कहीं मेरे जैसे तो मैफिल लगाओ,"Do not sell here, heart is love","Do not sell here, heart is love"
246.2K,174,24.6K,follow like share comment #aslam__1436,https://cdn4.sharechat.com/33d5318_26f/audio/1fdb039_1731380050906.mp3?tenant=moj&referrer=audio-service&f=33d5318_26f/audio/1fdb039_1731380050906.mp3," आप अपनी बेटी को बेटा कहकर बुला सकते एं, मगर भी आप को बेटी नहीं कह सकते, इसलिए बेटी Anmol होती है।","You can call your daughter as a son, but also you cannot call a daughter, so the daughter is anmol.","You can call your daughter as a son, but also you cannot call a daughter, so the daughter is anmol."
142.3K,100,6.7K,#TopGiftedVideos,https://cdn4.sharechat.com/33d5318_26f/audio/3195a6b8_1732199062040.mp3?tenant=moj&referrer=audio-service&f=33d5318_26f/audio/3195a6b8_1732199062040.mp3, निरे खबली खबली मैं ता सहर दिधन्दी शबनम हाँ गुल्शन का एतर चुड़ी,Nire Khabali Khabali I Ta Sahar Didhandi Shabnam yes,Nire Khabali Khabali I Ta Sahar Didhandi Shabnam yes
276.6K,251,21.6K,poster,https://cdn4.sharechat.com/33d5318_26f/audio/28de51f1_1728646438634.mp3?tenant=moj&referrer=audio-service&f=33d5318_26f/audio/28de51f1_1728646438634.mp3, आज आज,Today today,Today today
31.9K,49,3.1K,chota sa yek kam! #love  #song  #videos,https://cdn4.sharechat.com/33d5318_26f/audio/1eedb638_1730341611650.mp3?tenant=moj&referrer=audio-service&f=33d5318_26f/audio/1eedb638_1730341611650.mp3, छोटा सा तु मेरा एक काम कर दे तेरा सर नेम मेरे नाम कर दे,"You should do a small thing for me, do your head name to me","You should do a small thing for me, do your head name to me"
32.2K,44,2.7K,poster,https://cdn4.sharechat.com/24060546_1675267151222.mp3?tenant=moj&referrer=audio-service&f=24060546_1675267151222.mp3," तेनों दिल नार सदा लाके रखुँगा, खुशियां दाऊँगा पहरेदार हो गया","Teen dil will always keep the heart, happiness will be guarded","Teen dil will always keep the heart, happiness will be guarded"
94.5K,116,6K,poster,https://cdn4.sharechat.com/33d5318_26f/audio/166b59f7_1714610321750.m4a?tenant=moj&referrer=audio-service&f=33d5318_26f/audio/166b59f7_1714610321750.m4a, अड़ किसी डाढ़ी राखे पकड़ा सा छोरे मा गड़ में वादी,Adi -dadhi rakhe caught in a chick,Adi -dadhi rakhe caught in a chick
11.6K,5,529,poster,https://cdn4.sharechat.com/872eb9d_1668586343893.mp3?tenant=moj&referrer=audio-service&f=872eb9d_1668586343893.mp3, दोनों कहीं पे मिल जाएंगे एक दिन इन उम्मीदों पे ही मैं हूँ जिन्दा हर मन्जिल हासल हो,"Both will meet somewhere, one day I am alive on these expectations.","Both will meet somewhere, one day I am alive on these expectations."
91.6K,115,6.9K,poster,https://cdn4.sharechat.com/33d5318_26f/audio/15421473_1730529611754.mp3?tenant=moj&referrer=audio-service&f=33d5318_26f/audio/15421473_1730529611754.mp3, कोई तो राह वो होगी जो मेरे राह वो होगी,Someone will be the path that will be my path,Someone will be the path that will be my path
31.8K,38,2.9K,poster,https://cdn4.sharechat.com/f35a18_1607504604859.mp3?tenant=moj&referrer=audio-service&f=f35a18_1607504604859.mp3, हम दोनों कहीं पे मिल जाएंगे एक दिन इन उम्मीदों पे ही मैं हूँ जिन्दा हर मंज़ हास,"Both of us will meet somewhere, one day I am alive on these expectations","Both of us will meet somewhere, one day I am alive on these expectations"
13.1K,16,1.4K,poster,https://cdn4.sharechat.com/33d5318_26f/audio/2aec290d_1714551371001.m4a?tenant=moj&referrer=audio-service&f=33d5318_26f/audio/2aec290d_1714551371001.m4a," मैं तो कर लूँ सबर, माने दिल ना मगर, काशिब पहले से पता होता","I should do Sabar, Mane Dil Na Mar, Kashib would have known beforehand","I should do Sabar, Mane Dil Na Mar, Kashib would have known beforehand"
205.5K,79,17.8K,poster,https://cdn4.sharechat.com/33d5318_26f/audio/3359fe9_1729269861573.mp3?tenant=moj&referrer=audio-service&f=33d5318_26f/audio/3359fe9_1729269861573.mp3," जिन्दगी में हमेशा मेरी दो बात याद रहना पहला, कमाएगा तो खाएगा दूसरा, नहीं कमाएगा तो कलवा तो दिन पे दिन और कलाव तो जाएगा क्रीम पाउडर के पैसे कहां से लाएगा","Always remember my two things in life, first, if you earn, you will eat the second, if you do not earn, then Kalwa will go to day and Kalav to Kalav, where will the cream powder be brought from","Always remember my two things in life, first, if you earn, you will eat the second, if you do not earn, then Kalwa will go to day and Kalav to Kalav, where will the cream powder be brought from"
4.1K,6,183,poster,https://cdn4.sharechat.com/784434_1700184307672.mp3?tenant=moj&referrer=audio-service&f=784434_1700184307672.mp3, बनके हवा मैं बेजुबा मैं दिल लगाने आँगा रातों को तेरा छाद बनके,"In the air, I will be heartbroken in the air","In the air, I will be heartbroken in the air"
3.7K,14,388,poster,https://cdn4.sharechat.com/33d5318_26f/audio/39144f44_1733124068465.mp3?tenant=moj&referrer=audio-service&f=33d5318_26f/audio/39144f44_1733124068465.mp3, आप कौन हैं? मैं वहाँ थीन्य। मेरे ज्वाल में वहीन्य।,Who are you?I the thein there.Intraine in my volcano.,Who are you?I the thein there.Intraine in my volcano.
66.6K,56,8.1K,poster,https://cdn4.sharechat.com/33d5318_26f/audio/2b7d346_1733947965280.mp3?tenant=moj&referrer=audio-service&f=33d5318_26f/audio/2b7d346_1733947965280.mp3, जो लोग सुबह लेट उठते हैं वो आलसी नहीं होते उनके सपने बड़े होते हैं देखने में टाइम लगता है बाई,"Those who get up late in the morning are not lazy, their dreams are big, it takes time to see Bai","Those who get up late in the morning are not lazy, their dreams are big, it takes time to see Bai"
58.4K,20,3.3K,thank you 🙏please Sapot♥️..,https://cdn4.sharechat.com/bbcc118_1675189340644.mp3?tenant=moj&referrer=audio-service&f=bbcc118_1675189340644.mp3, बिखरा हुआ था काच के जैसा छूली,Was scattered like Kach,Was scattered like Kach
105.2K,188,14.4K,❤️❤️❤️❤️,https://cdn4.sharechat.com/33d5318_26f/audio/35cdbd22_1730862127857.mp3?tenant=moj&referrer=audio-service&f=33d5318_26f/audio/35cdbd22_1730862127857.mp3, ये जिन्दगान तेरे हवाने कर दिये,This life gave you to you,This life gave you to you
62.5K,97,2.6K,poster,https://cdn4.sharechat.com/33d5318_26f/audio/21e3f54d_1730369080205.mp3?tenant=moj&referrer=audio-service&f=33d5318_26f/audio/21e3f54d_1730369080205.mp3, कि आपकी प्रदान पर देख रहा है कि आप इस प्रेसिडेंट को ने फोन पर दिया था कि आप इस प्रेसिडेंट को ने फोन पर दिया था,It is seen on your provision that you gave this president on the phone that you gave this president on the phone.,It is seen on your provision that you gave this president on the phone that you gave this president on the phone.
63.6K,59,11.5K,poster,https://cdn4.sharechat.com/33d5318_26f/audio/2db04d12_1729658048623.mp3?tenant=moj&referrer=audio-service&f=33d5318_26f/audio/2db04d12_1729658048623.mp3, हम दिवाने हैं पेश करें,We are crazy,We are crazy
15.9K,30,3K,poster,https://cdn4.sharechat.com/33d5318_26f/audio/36c32cae_1728604830315.mp3?tenant=moj&referrer=audio-service&f=33d5318_26f/audio/36c32cae_1728604830315.mp3, कि अ,That a,That a
126.2K,162,25.9K,#🌼🏵️🍁🌺🌺🙏🌹🌹🌸💐🌷💮💮💮😄🌻🙏🙏🙏🙏🙏🙏🙏,https://cdn4.sharechat.com/33d5318_26f/audio/30396065_1732862898031.mp3?tenant=moj&referrer=audio-service&f=33d5318_26f/audio/30396065_1732862898031.mp3, अपने वर्डसप पे स्टेटस लगाया करो ताकि जो तुमसे जलते हैं ना उनकी,Apply a status on your Wordsap so that those who burn you,Apply a status on your Wordsap so that those who burn you
55.9K,23,10.7K,#khud #itna #badal #dunga #ki #🙏😔💔😔🙏💔log,https://cdn4.sharechat.com/33d5318_26f/audio/140a11f6_1730717644098.mp3?tenant=moj&referrer=audio-service&f=33d5318_26f/audio/140a11f6_1730717644098.mp3, रात भर बसे राहे,Nestlings overnight,Nestlings overnight
277.8K,218,28.2K,#baby #babyreels #reels #reelsinstagram #instagood #instadaily #instagram #dubaibaby #cutebaby #babiesofinstagram #babies #hudafatyma_world #music #song,https://cdn4.sharechat.com/33d5318_26f/audio/2ffd92cc_1732502495814.m4a?tenant=moj&referrer=audio-service&f=33d5318_26f/audio/2ffd92cc_1732502495814.m4a, कौन कहता है कि बेटी ये बोज होती हैं? मेरी बेटी घर की रोनक है,Who says the daughter is these boys?My daughter is home,Who says the daughter is these boys?My daughter is home
8.9K,33,904,#NIVEASoftPerformerChallenge #ItsMyStyle #TopGiftedVideos,https://cdn4.sharechat.com/33d5318_26f/audio/383490e6_1731926065081.mp3?tenant=moj&referrer=audio-service&f=33d5318_26f/audio/383490e6_1731926065081.mp3, अजय को अजय को अजय को,Ajay gets Ajay to Ajay,Ajay gets Ajay to Ajay
223.4K,185,38K,poster,https://cdn4.sharechat.com/1e2b6fa6_1655955437234.mp3?tenant=moj&referrer=audio-service&f=1e2b6fa6_1655955437234.mp3," जागे जागे रहते थे, खोए खोए रहते थे, करते थे प्यार की बातें, कभी तनहाई में, कभी पुरवाई में होती थी","Waking up, he used to stay awake, lost lost, used to talk of love, sometimes in lonely, sometimes in Puravai","Waking up, he used to stay awake, lost lost, used to talk of love, sometimes in lonely, sometimes in Puravai"
69.7K,65,9K,"It is the life 
 #motiv-motive 
 #moj @moj",https://cdn4.sharechat.com/33d5318_26f/audio/2e2ef762_1714195757068.m4a?tenant=moj&referrer=audio-service&f=33d5318_26f/audio/2e2ef762_1714195757068.m4a, मिट्टी से बने हैं मिट्टी में मिल जाएंगे रोते हुए आये थे रुलाते हुए छोड़ जाएंगे,"Made of mud, you will meet in the soil and come crying, they will leave and leave","Made of mud, you will meet in the soil and come crying, they will leave and leave"
136K,13,12.5K,poster,https://cdn4.sharechat.com/33d5318_26f/audio/14830169_1732258092889.mp3?tenant=moj&referrer=audio-service&f=33d5318_26f/audio/14830169_1732258092889.mp3," पैसा कितना भी गिर जाए, पर इतना कभी नहीं गिरता, जितना इंसान पैसों के लिए गिरता है","No matter how much money falls, but never falls so much as a person falls for money","No matter how much money falls, but never falls so much as a person falls for money"
46.7K,20,2.6K,🤣🤣🤣🤣,https://cdn4.sharechat.com/33d5318_26f/audio/7074fea_1734675062080.mp3?tenant=moj&referrer=audio-service&f=33d5318_26f/audio/7074fea_1734675062080.mp3, इस विशेष पर प्रशान नहीं रहा है।,This special has not been praised.,This special has not been praised.
20.3K,7,4.9K,eatityud #TrendingOnMoj,https://cdn4.sharechat.com/33d5318_26f/audio/2e02c709_1733828147261.mp3?tenant=moj&referrer=audio-service&f=33d5318_26f/audio/2e02c709_1733828147261.mp3, अगर कभी आपका कोई कपड़ा फट जाए तो उसे फेंकने की बजाए सबसे पहले आपको उस फटी हुई जगह के चारों तरफ वीडियो में दिखाए गए तरीके से एक स्टार बनाना है। उसके बाद उस स्टार के अंदर जो खाली जगह है उसे आपने सील देना है। इतना करने के बाद आपका फटा हुआ कपड़ा पहनने लायक बन जाएगा।,"If you ever burst a cloth, instead of throwing it, first you have to make a star shown in the video around that torn place.After that, you have to seal the empty space inside that star.After doing this, your torn cloth will become worth wearing it.","If you ever burst a cloth, instead of throwing it, first you have to make a star shown in the video around that torn place.After that, you have to seal the empty space inside that star.After doing this, your torn cloth will become worth wearing it."
18.1K,5,3K,"I love you 💗💗 
I miss you 🥺😙 
 #loveu #loveu #kiss #cutecouple",https://cdn4.sharechat.com/33d5318_26f/audio/24f830ba_1734797553680.m4a?tenant=moj&referrer=audio-service&f=33d5318_26f/audio/24f830ba_1734797553680.m4a, नजरना,Ignore,Ignore
118.5K,46,8.9K,#,https://cdn4.sharechat.com/33d5318_26f/audio/300f019e_1731036762950.mp3?tenant=moj&referrer=audio-service&f=33d5318_26f/audio/300f019e_1731036762950.mp3, कर दो कर दो कर दो कर दो कर दो कर दो,"Do two tax two tax, do two tax","Do two tax two tax, do two tax"
221.6K,307,30.6K,poster,https://cdn4.sharechat.com/33d5318_26f/audio/251af789_1728432744135.mp3?tenant=moj&referrer=audio-service&f=33d5318_26f/audio/251af789_1728432744135.mp3, तूने दिल के रखी पोशंद मेरे,You put my heart in my heart,You put my heart in my heart
268,1,16,poster,https://cdn4.sharechat.com/33d5318_26f/audio/36096755_1734975178277.mp3?tenant=moj&referrer=audio-service&f=33d5318_26f/audio/36096755_1734975178277.mp3, प्रस्तुति प्रस्तुति प्रस्तुति प्रस्तुति प्रस्तुति प्रस्तुति प्रस्तुति प्रस्तुति प्रस्तुति प्रस्तुति प्रस्तुति प्रस्तुति प्रस्तुति प्रस्तुति प्रस्तुति प्रस्तुति प्रस्तुति प्रस्तुति प्रस्तुति प्रस्तुति प्,Presentation Presentation Presentation Presentation Presentation Presentation Presentation Presentation Presentation Presentation Presentation Presentation Presentation Presentation Presentation Presentation Presentation Presentation Presentation Presentation Presentation Presentation Presentation Presentation Presentation,Presentation Presentation Presentation Presentation Presentation Presentation Presentation Presentation Presentation Presentation Presentation Presentation Presentation Presentation Presentation Presentation Presentation Presentation Presentation Presentation Presentation Presentation Presentation Presentation Presentation
1.4K,2,231,dst🥰🥰,https://cdn4.sharechat.com/33d5318_26f/audio/e34f279_1730270472539.mp3?tenant=moj&referrer=audio-service&f=33d5318_26f/audio/e34f279_1730270472539.mp3, जीवन आसन नहीं है मेरे दोस्त ज्यादा बात करो तो पागल कम बात करो तो वमंडी काम की बात करो तो मतलबी,"Life is not a posture, my friends talk more, if you talk crazy, then talk about the work of the work.","Life is not a posture, my friends talk more, if you talk crazy, then talk about the work of the work."
149.9K,124,18K,💯🖤🥀 #mdsa #mdsalman9006 #mdsalman1475 #moj #gitex #hijab #moi-moj-moj-moj-moj_+mojl--mojl-+moji-moj-mojj-moja??…momj-moji-mojj-moja?mojb??moj।mojp⁸mojp⁸mojು,https://cdn4.sharechat.com/33d5318_26f/audio/2a4d48a6_1730435754224.mp3?tenant=moj&referrer=audio-service&f=33d5318_26f/audio/2a4d48a6_1730435754224.mp3, गरीब घरों में भी रिष्टे कीजे साहेब खुदा की कसम बड़े सलीके से रहती हैं गरीब घर की बेटियां,"Even in poor houses, Kije Saheb Khuda's swears lives very well, daughters of poor house","Even in poor houses, Kije Saheb Khuda's swears lives very well, daughters of poor house"
6.2K,11,1.1K,poster,https://cdn4.sharechat.com/cea8ca0_1662323318340.mp3?tenant=moj&referrer=audio-service&f=cea8ca0_1662323318340.mp3, अभी जिन्दा हूँ तो बात कर लिया करो अगर मरने के बाद मैंने बात करने शुरू कर दी ना ताबीज बनवाते फिरोगे,"If I am alive now, then talk, if I started talking after dying, you will not make amulets.","If I am alive now, then talk, if I started talking after dying, you will not make amulets."
89.4K,58,13.7K,poster,https://cdn4.sharechat.com/bb120b1_1690956014950.mp3?tenant=moj&referrer=audio-service&f=bb120b1_1690956014950.mp3, बिना तेरे कोई दिल कर्ष नजारा हम न देखेंगे तुम्हे न हो पसंद उसको दुबारा हम न देखेंगे,"We will not see you without any heart, you will not like it again, we will not see it again","We will not see you without any heart, you will not like it again, we will not see it again"
67.9K,46,20.2K,poster,https://cdn4.sharechat.com/33d5318_26f/audio/54059be_1732442396681.mp3?tenant=moj&referrer=audio-service&f=33d5318_26f/audio/54059be_1732442396681.mp3, ओई मेरी क्यूट सी जान खाना वना खा लिया या मैं खिला नहीं आओ,"Oi my cute life, eaten food or i don't feed","Oi my cute life, eaten food or i don't feed"
10K,11,1.7K,#NIVEASoftPerformerChallenge #ItsMyStyle #NIVEASoftBeautyChallenge #HappyChildrensDay #TopGiftedVideos #AayiNai #MeraRangDeBasantiChola #TaubaTauba #DekhaTenu #Zaalimaa,https://cdn4.sharechat.com/33d5318_26f/audio/103d1b6_1730547979586.mp3?tenant=moj&referrer=audio-service&f=33d5318_26f/audio/103d1b6_1730547979586.mp3, या या या या या या या या या या या या या या या या या या या या या या या या या या या या या या या या या या या या या या या या या या या या या या या या या या या या या या या या या या या या या या या या या या या या या या या या या या �,"Or or or or or or or or or or or or or or or or or or or or or or or or or or or or or or or or or or or or or or or or or or or or or or or or or or or or or or or or or or or or or or or or or or or or or or or or or or or or or not,Or or or or or or or or or or or or or or or or or or or or or or or or or or or or or or or or or or or or or �","Or or or or or or or or or or or or or or or or or or or or or or or or or or or or or or or or or or or or or or or or or or or or or or or or or or or or or or or or or or or or or or or or or or or or or or or or or or or or or not,Or or or or or or or or or or or or or or or or or or or or or or or or or or or or or or or or or or or or or �"
179.8K,1.3K,10.8K,Harshit kumar,https://cdn4.sharechat.com/33d5318_26f/audio/305b63ec_1730108132094.mp3?tenant=moj&referrer=audio-service&f=33d5318_26f/audio/305b63ec_1730108132094.mp3, ये मेरी भाँजी है और मैं उसकी खाला हूँ देख सकते हैं हम दोलो सेम सेम हैं कोई बता सकता है कि हम लोग भाँजी और खाला है,"This is my niest and I can see that we can see that we are a couple beans, someone can tell that we are niece and well","This is my niest and I can see that we can see that we are a couple beans, someone can tell that we are niece and well"
18.1K,22,806,संतोष पागल नहीं 😄,https://cdn4.sharechat.com/33d5318_26f/audio/161a1b36_1727096616881.mp3?tenant=moj&referrer=audio-service&f=33d5318_26f/audio/161a1b36_1727096616881.mp3, संतोष पागल नाई वन पुझे जादा तुछी राई उड़न बाज हो ता पुझली हम और दोहम हाई रांगा बाज हो तु जानत हुआ कि हम ग्रेडे पाउल नहीं कि अ,Santosh Pagal Nai Van Pujhe Jada Jada Tuchi Rai Udan Baj Ho Ta Pujhli Hum and Doham High Ranga Baj Ho Tu Know that we are not Grade Paul,Santosh Pagal Nai Van Pujhe Jada Jada Tuchi Rai Udan Baj Ho Ta Pujhli Hum and Doham High Ranga Baj Ho Tu Know that we are not Grade Paul
32.5K,19,1.7K,#waterpark,https://cdn4.sharechat.com/33d5318_26f/audio/1c994144_1719047914567.mp3?tenant=moj&referrer=audio-service&f=33d5318_26f/audio/1c994144_1719047914567.mp3, आज बिल है पानी पानी पानी पानी पानी पानी पानी और तुम भी सानी सानी सानी सानी सानी सानी सानी आजाओ,Today the bill is the bill water water water water,Today the bill is the bill water water water water
23.5K,14,910,poster,https://cdn4.sharechat.com/1047342c_1626771462148.mp3?tenant=moj&referrer=audio-service&f=1047342c_1626771462148.mp3, तो मेरे भैया तो,So my brother,So my brother
