Likes,Comments,Shares,Content,Audio URL,Transcription,English,
216.8K,131,73.3K,poster,https://cdn4.sharechat.com/2f3639fb_1700986341752.mp3?tenant=moj&referrer=audio-service&f=2f3639fb_1700986341752.mp3, प्रश्न प्रश्न प्रश्न प्रश्न प्रश्न प्रश्न प्रश्न प्रश्न प्रश्न प्रश्न प्रश्न प्रश्न प्रश्न प्रश्न प्रश्न प्रश्न प्रश्न प्रश्न प्रश्न प्रश्न प्रश्न प्रश्न प्रश्न प्रश्न प्रश्न प्रश्न प्रश्न प्रश्,Question Question Question Question Question Question Question Question Question Question Question Question Question Question Question Question Question Question Question Question Question Question Question Question Question Question Question Question Question Question Question Question Question Question Question Question Question,Question Question Question Question Question Question Question Question Question Question Question Question Question Question Question Question Question Question Question Question Question Question Question Question Question Question Question Question Question Question Question Question Question Question Question Question Question
58.7K,115,9.6K,#NIVEASoftBeautyChallenge #AageBadhJa #ShubhDhanTeras #HappyDiwali #TopGiftedVideos #AayiNai #TaubaTauba,https://cdn4.sharechat.com/33d5318_26f/audio/36cdf2f1_1730601973783.mp3?tenant=moj&referrer=audio-service&f=33d5318_26f/audio/36cdf2f1_1730601973783.mp3, और मिलो या ना मिलो हम आपके हैं मिलो ना मिलो हम आपके हैं जब हमारी ये निष्ठा है तो प्रतिपल मिले रहते हैं,"And meet or not meet, we are yours, do not meet you, we are yours, when we have this loyalty, then we get the moment","And meet or not meet, we are yours, do not meet you, we are yours, when we have this loyalty, then we get the moment"
104.1K,197,9.6K,poster,https://cdn4.sharechat.com/33d5318_26f/audio/40e7c1d_1732349993117.mp3?tenant=moj&referrer=audio-service&f=33d5318_26f/audio/40e7c1d_1732349993117.mp3, तू दूर नहोना शम्द मैं किसी आओ,"You are not far away, I come to someone","You are not far away, I come to someone"
95.7K,65,15.9K,#TopGiftedVideos,https://cdn4.sharechat.com/33d5318_26f/audio/5e37330_1728970770064.mp3?tenant=moj&referrer=audio-service&f=33d5318_26f/audio/5e37330_1728970770064.mp3, सबसे भरोसेमन्द इनसान ही दोका देता है ये आज से नहीं महाभारत के वक्त से चला रहा है,"The most trusted person gives it that it is running from today, not from the time of Mahabharata.","The most trusted person gives it that it is running from today, not from the time of Mahabharata."
44.9K,126,9.4K,#NIVEASoftFashionChallenge,https://cdn4.sharechat.com/33d5318_26f/audio/4dce5f3_1732342027062.mp3?tenant=moj&referrer=audio-service&f=33d5318_26f/audio/4dce5f3_1732342027062.mp3, कर दो,Do it,Do it
19.5K,38,5.2K,#NIVEASoftBeautyChallenge #HappyDiwali #AayiNai #DekhaTenu #MeraRangDeBasantiChola #TopGiftedVideos,https://cdn4.sharechat.com/33d5318_26f/audio/15e449d3_1729866047981.mp3?tenant=moj&referrer=audio-service&f=33d5318_26f/audio/15e449d3_1729866047981.mp3, सही कहा है किसी ने सच्चा प्यार करने वाले की कदर नहोती,It is right that no one has appreciated the true love,It is right that no one has appreciated the true love
52.3K,21,6K,"share your love 💕💘💗❣️♥️🫀💖💓🌹❤️❤️‍🩹❤️‍🔥💝💞💋🙌🙏🙏🙏🙏
 #moj",https://cdn4.sharechat.com/33d5318_26f/audio/f41360d_1714197257839.m4a?tenant=moj&referrer=audio-service&f=33d5318_26f/audio/f41360d_1714197257839.m4a," ओ मेरे खाबादी तू राणी, सड़ी सची एक वहाणी, राब सच्च सड़ प्यार दगवा हो गया तेरे नाल प्यार हो गया","O mere khabadi tu rani, roti sachi a wahani","O mere khabadi tu rani, roti sachi a wahani"
174.1K,369,32K,poster,https://cdn4.sharechat.com/33d5318_26f/audio/3099f9cc_1729304193523.mp3?tenant=moj&referrer=audio-service&f=33d5318_26f/audio/3099f9cc_1729304193523.mp3, वन्जिल का तो पता नहीं पर रास्ता सब कुछ सिखा ही देता है और अकेले चलना सीखे जनाब क्यूंकि सहारा कितना भी सच्चा हो एक दिन अपनी उकार दिखा ही देता है,"Wanjil does not know, but the path is taught everything and learn to walk alone, because no matter how true the support is one day, one day shows its excitement","Wanjil does not know, but the path is taught everything and learn to walk alone, because no matter how true the support is one day, one day shows its excitement"
25.1K,31,1.2K,@viral sad status,https://cdn4.sharechat.com/33d5318_26f/audio/32acbbe0_1733060747030.mp3?tenant=moj&referrer=audio-service&f=33d5318_26f/audio/32acbbe0_1733060747030.mp3, यह जारू है जिवाद मैं खमादार अस्य मिले जी हो,"This is Jaru who will be a sore,","This is Jaru who will be a sore,"
40.8K,61,7.1K,#broken-brokn-broken-broke💔brokeen,https://cdn4.sharechat.com/33d5318_26f/audio/eb30c05_1731090126615.mp3?tenant=moj&referrer=audio-service&f=33d5318_26f/audio/eb30c05_1731090126615.mp3, सुनता नहीं कहना कोई,No one says to hear,No one says to hear
197.4K,153,23.6K,poster,https://cdn4.sharechat.com/33d5318_26f/audio/17730158_1729653390377.mp3?tenant=moj&referrer=audio-service&f=33d5318_26f/audio/17730158_1729653390377.mp3, पहले लोग लड़कियों के पीछे समय और पैसा दोनों बरबात करते थे पर अब लोग समझदार हो गये हैं इसलिए साधी सुदा और दो बच्चों की मम्मी पर ज़्यादा ध्यान,"Earlier people used to spend both time and money behind the girls, but now people have become intelligent, so more attention on the mother's mother and the mother's mother","Earlier people used to spend both time and money behind the girls, but now people have become intelligent, so more attention on the mother's mother and the mother's mother"
190.6K,75,21.6K,poster,https://cdn4.sharechat.com/33d5318_26f/audio/1bc95218_1725389195740.mp3?tenant=moj&referrer=audio-service&f=33d5318_26f/audio/1bc95218_1725389195740.mp3, एक बात याद रखना कि खुदा बेटियां भी उन्हें देता है जिनकी पालने की उकात हो,Remember one thing that God also gives daughters who have to raise the cradle,Remember one thing that God also gives daughters who have to raise the cradle
325.1K,331,33.8K,poster,https://cdn4.sharechat.com/33d5318_26f/audio/9a8b915_1726426310495.mp3?tenant=moj&referrer=audio-service&f=33d5318_26f/audio/9a8b915_1726426310495.mp3, घर की सबसे बड़ी बेटी को सबसे ज़्यादा प्यार मिलता है लेकिन ये बात भी सच है कि जिसको सबसे ज़्यादा प्यार मिलता है जिन्दगी उसी के साथ खेलती है घर की सबसे बड़ी बेटी को सबसे ज़्यादा प्यार मिलता है लेकिन ये बात भी सच है कि जिसको सबसे ज़्यादा प्यार मिलता है जिन्दगी उसी के साथ खेलती है घर की सबसे बड़ी बेटी को सबसे ज़्यादा प्यार मिलता है लेकिन ये बात भी सच है कि जिसको सबसे ज़्यादा प्यार मिलता है जिन्दगी उसी के साथ खिलती है,"The eldest daughter of the house gets the most love, but it is also true that the one who gets the most love, life plays with him the eldest daughter of the house gets the most, but it is also true that the mostLife gets more love, life plays with him, the eldest daughter of the house gets the most love, but it is also true that the one who gets the most love blooms with him","The eldest daughter of the house gets the most love, but it is also true that the one who gets the most love, life plays with him the eldest daughter of the house gets the most, but it is also true that the mostLife gets more love, life plays with him, the eldest daughter of the house gets the most love, but it is also true that the one who gets the most love blooms with him"
148.6K,22,11.4K,#🥺🥺🥺,https://cdn4.sharechat.com/33d5318_26f/audio/140d9e57_1732111784197.mp3?tenant=moj&referrer=audio-service&f=33d5318_26f/audio/140d9e57_1732111784197.mp3, सब कुछ मिल जाता है सिवा एक चीज के सच्चा प्यार,Everything is found except the true love of one thing,Everything is found except the true love of one thing
342.1K,362,65.6K,poster,https://cdn4.sharechat.com/33d5318_26f/audio/e198816_1729339461006.mp3?tenant=moj&referrer=audio-service&f=33d5318_26f/audio/e198816_1729339461006.mp3," पता है इनसान सब कुछ सेहन कर सकता है सब कुछ दुनिया की मार, अपनों की डाट, लड़ाई, जगड़े, रिजेक्शन्स पर पता है क्या नहीं सेहन कर सकता उसके किसी खास इनसान से लगाई हुए एक्स्टप्टेशन्स का तूट जाना","You know that a person can do everything, everything can be known on the world, the faults of the world, the fight, the jagade, the rejections, what cannot be done,","You know that a person can do everything, everything can be known on the world, the faults of the world, the fight, the jagade, the rejections, what cannot be done,"
312.5K,574,27.4K,I love you maa 😎☺😚.........,https://cdn4.sharechat.com/33d5318_26f/audio/506f20c_1724228984958.mp3?tenant=moj&referrer=audio-service&f=33d5318_26f/audio/506f20c_1724228984958.mp3, कि अ अ अ अ अ अ अ अ अ अ अ अ,That A A A A A A A A A A,That A A A A A A A A A A
12.5K,23,483,Takle 😂KI Shaadi 🤪😂 #factsvirals,https://cdn4.sharechat.com/33d5318_26f/audio/86f96c1_1729899403229.mp3?tenant=moj&referrer=audio-service&f=33d5318_26f/audio/86f96c1_1729899403229.mp3, देखो इस काले लड़के को आज लड़की वाले देखने आने वाले होते हैं और जैसे ही इसको यह पता चलता है तो यह तुरंत भाकर सैलून आ जाता है और नाई से कहता है भईया आप मेरे सर पर कैसे भी करके बाल और दाड़ी उगा दो जितना पैसा लगेगा मैं दूँगा यह सुनकर नाई को भी लालच आ जाता है और तुरंत इस टकले का सर मापने लगता है यहां तक की दाड़ी को मापता है इसके बाद इसके सर पर गुलू लगा कर बाल दाड़ी को चिपका देता है और कटिंग करके ऐसा कर देता है जो बिलकुल देखने में असली लग रहा था यह देखकर यह लड़का खुश हो जाता है चलो इस टकले को शादी के लिए बधाई दे दो लाइक कर दो,"Look, this black boy is going to see the girl today and as soon as he comes to know about it, it immediately comes to the salon and tells the barber, brother, how can you grow hair and beard as much as you do on my head.Hearing that I will give this, the barber also gets greed and immediately measures the head of this takle, even measures the beard, after this, by applying gulu on its head, the hair sticks the beard and cuts it and does it which is absolutelySeeing that it seemed real, this boy becomes happy, let's congratulate this tuck for the wedding, like it","Look, this black boy is going to see the girl today and as soon as he comes to know about it, it immediately comes to the salon and tells the barber, brother, how can you grow hair and beard as much as you do on my head.Hearing that I will give this, the barber also gets greed and immediately measures the head of this takle, even measures the beard, after this, by applying gulu on its head, the hair sticks the beard and cuts it and does it which is absolutelySeeing that it seemed real, this boy becomes happy, let's congratulate this tuck for the wedding."
58.9K,52,3.3K,poster,https://cdn4.sharechat.com/33d5318_26f/audio/1d2875d5_1730142478500.mp3?tenant=moj&referrer=audio-service&f=33d5318_26f/audio/1d2875d5_1730142478500.mp3, पहला तेरे नैन में देखे फिर देखे आते नूनी छेती आके मिल जा बीबा मिल जाया के मैं नूनी वस्वबार दिल हो गया,"The first was seen in your nain, then I am seen, Nuni Chheti Aa Mil Ja Biba Mill Jaya I am heartbroken","The first was seen in your nain, then I am seen, I am going to meet Nuni Chheti Aa Mil Jaya, I became a heart"
1.9K,1,81,poster,https://cdn4.sharechat.com/33d5318_26f/audio/8ba0a67_1710862491770.mp3?tenant=moj&referrer=audio-service&f=33d5318_26f/audio/8ba0a67_1710862491770.mp3, मेरे अपने ही लोगों ने मेरा दर्द न जाना था,My own people did not know my pain,My own people did not know my pain
19.6K,17,846,poster,,,,
225.1K,591,22.7K,poster,https://cdn4.sharechat.com/31623ca0_1705915193427.mp3?tenant=moj&referrer=audio-service&f=31623ca0_1705915193427.mp3, भाई भावी की फोटो मिल गई बेज रहा हूँ देख कर बता कैसी है,"I am sending a photo of brother -in -law, and tell me how it is","I am sending a photo of brother -in -law, and tell me how it is"
84.8K,42,20.6K,poster,https://cdn4.sharechat.com/33d5318_26f/audio/2a42f1d9_1730250638708.mp3?tenant=moj&referrer=audio-service&f=33d5318_26f/audio/2a42f1d9_1730250638708.mp3, चलो अच्छा है यार हम किसी को अच्छे नहीं लगते मेरे मरने के बाद कोई रोएगा तो नहीं,"Come on, it is good man, we do not like anyone, no one will cry after I die","Come on, it is good, no one likes anyone, if someone will cry after I die"
61.9K,56,17.7K,poster,https://cdn4.sharechat.com/33d5318_26f/audio/5d12162_1729340092205.mp3?tenant=moj&referrer=audio-service&f=33d5318_26f/audio/5d12162_1729340092205.mp3, जो हम पर वरोसा करता है हम उन्हें जान दे सकते हैं लेकिन दोखा नहीं,We can kill those who Varosa on us but not Dakha,We can kill those who Varosa on us but not Dakha
52K,101,8.4K,#NIVEASoftFashionChallenge #HappyChildrensDay #AayiNai #MeraRangDeBasantiChola #PaonKiJutti dhokebaj dhokebaj 25 ke,https://cdn4.sharechat.com/33d5318_26f/audio/1745d2f7_1730611248436.mp3?tenant=moj&referrer=audio-service&f=33d5318_26f/audio/1745d2f7_1730611248436.mp3, अजय को,To Ajay,To Ajay
35.2K,28,4.2K,😆😇😄😆,https://cdn4.sharechat.com/33d5318_26f/audio/1be1e1fd_1733561489044.mp3?tenant=moj&referrer=audio-service&f=33d5318_26f/audio/1be1e1fd_1733561489044.mp3," क्या लेकर आये थे, क्या लेकर जाओगे, मुझे मेसेज ना करके, कितना MB डाटा बचाओगे","What did you bring, what will you go, do not message me, how much MB will save me","What did you bring, what will you go, do not message me, how much MB will save me"
153.3K,76,17.3K,#TopGiftedVideos #trendingonmoj #payalmalik,https://cdn4.sharechat.com/33d5318_26f/audio/9f4667e_1721447507241.mp3?tenant=moj&referrer=audio-service&f=33d5318_26f/audio/9f4667e_1721447507241.mp3, प्रेसिडेशन प्रेसिडेशन,Presidential president,Presidential president
33.7K,81,2.5K,poster,https://cdn4.sharechat.com/33d5318_26f/audio/d74f843_1730126726694.mp3?tenant=moj&referrer=audio-service&f=33d5318_26f/audio/d74f843_1730126726694.mp3, पुम तो शायद जीलो,Pum perhaps,Pum perhaps
83.8K,26,10K,old song,https://cdn4.sharechat.com/33d5318_26f/audio/1ca29a0d_1730041228674.mp3?tenant=moj&referrer=audio-service&f=33d5318_26f/audio/1ca29a0d_1730041228674.mp3, हे हे हाँ हाँ ला ला ला ला ला ला,Hey yes yes yes la la la la la la la la,Hey yes yes yes la la la la la la la la
59.2K,43,15.8K,poster,https://cdn4.sharechat.com/33d5318_26f/audio/1f811ceb_1728870888280.mp3?tenant=moj&referrer=audio-service&f=33d5318_26f/audio/1f811ceb_1728870888280.mp3," तुम्हारी खुशी जिससे हो, तुम मुझसे बात कर सकती हो। और हाँ, जब तुम्हारा टाइम पास ना हो, तो मुझे इस पास ना रखें।","Which is your happiness, you can talk to me.And yes, when your time is not near, do not keep me near it.","Which is your happiness, you can talk to me.And yes, when your time is not near, do not keep me near it."
613K,804,52.4K,#3d #house,https://cdn4.sharechat.com/33d5318_26f/audio/1d256213_1729677930547.mp3?tenant=moj&referrer=audio-service&f=33d5318_26f/audio/1d256213_1729677930547.mp3, प्रस्तुति प्रस्तुति,Presentation presentation,Presentation presentation
16K,167,2.6K,follow me,https://cdn4.sharechat.com/2a0be080_1698408083620.mp3?tenant=moj&referrer=audio-service&f=2a0be080_1698408083620.mp3, Old flame का मतलब पुराना प्यार Red letter day का मतलब खुशी का दिन Blind date का मतलब किसी अंजान व्यक्ति से मिलना Buzzing friend का मतलब जिगरी दोस्त Fancy price का मतलब मुह मांगी कीमत Big gun का मतलब बहुत बड़ी पहुँच वाला आदमी ये sentence एडवांस अंग्रेजी के है ऐसे sentence बोलते वक्त आप बहुत smart लगोगे,"Old Flame means old love red letter day means pleasure day Blind Date means meeting an unknown person Buzzing Friend means Jiggeri friend fancy price means the meaning of Mouth, Big Gun means Big Gun means very big access man.You will look very smart while saying such sentence","Old Flame means old love red letter day means pleasure day Blind Date means meeting an unknown person Buzzing Friend means Jiggeri friend fancy price means the meaning of Mouth, Big Gun means Big Gun means very big access man.You will look very smart while saying such sentence"
153.1K,32,11.1K,👍👍💯,https://cdn4.sharechat.com/36206055_1698940132514.mp3?tenant=moj&referrer=audio-service&f=36206055_1698940132514.mp3, जिसने प्यार किया है उसका दर्द कोई ना बाटे,No one has saved the pain of the person who has loved,No one has saved the pain of the person who has loved
28.8K,40,27.5K,@_madhu1996 @sandhya_pahurkar #ItsMyStyle #TopGiftedVideos,https://cdn4.sharechat.com/33d5318_26f/audio/26aa0e5b_1733331952410.mp3?tenant=moj&referrer=audio-service&f=33d5318_26f/audio/26aa0e5b_1733331952410.mp3," कहां से तु आया, कहां जाएगा तु","Where did you come from, where will you go","Where did you come from, where will you go"
145K,62,23.7K,poster,https://cdn4.sharechat.com/33d5318_26f/audio/153c0cf2_1730480225454.mp3?tenant=moj&referrer=audio-service&f=33d5318_26f/audio/153c0cf2_1730480225454.mp3, सपले होते हैं अपने थे,There are supplements,There are supplements
120K,135,11.9K,#TrendingOnMoj,https://cdn4.sharechat.com/33d5318_26f/audio/2ad20190_1727680265714.mp3?tenant=moj&referrer=audio-service&f=33d5318_26f/audio/2ad20190_1727680265714.mp3, थोड़े काजू किश्मिश लेते चले सब थोड़ा थोड़ा लेते चले,"Taking a little cashew nuts, everyone kept taking a little bit","Taking a little cashew nuts, everyone kept taking a little bit"
10.4K,15,4.5K,🍁🍁🍁🍁🍁,https://cdn4.sharechat.com/33d5318_26f/audio/b7ac96b_1731044061866.mp3?tenant=moj&referrer=audio-service&f=33d5318_26f/audio/b7ac96b_1731044061866.mp3, दिवानों के जैसे करते हो,Do you like divans,Do you like divans
86.5K,132,9.1K,poster,https://cdn4.sharechat.com/33d5318_26f/audio/1821040b_1727086081851.mp3?tenant=moj&referrer=audio-service&f=33d5318_26f/audio/1821040b_1727086081851.mp3, लड़ो क्या खा रहा है? हगला मोजा हाँ? हगला मोजा दिखाओ ये क्या है? हगला मोजा पावे हज मोला होता है,"Fight what is eating?Hagla Moja Yes?Show Hagla Moja, what is this?Hagla Moja Paave Haj Mola","Fight what is eating?Hagla Moja Yes?Show Hagla Moja, what is this?Hagla Moja Paave Haj Mola"
185.9K,187,18.4K,poster,https://cdn4.sharechat.com/33d5318_26f/audio/13e65b4a_1727113550195.mp3?tenant=moj&referrer=audio-service&f=33d5318_26f/audio/13e65b4a_1727113550195.mp3, चाहने वाले कम हो जाएं तो चलेगा लेकिन जलने वालों की संख्या बढ़ती रहनी चाहिए,"If the fans are reduced, then the number of burns should continue to increase","If the fans are reduced, then the number of burns should continue to increase"
195.8K,78,12.5K,🥱😃 #FrameBizz,https://cdn4.sharechat.com/33d5318_26f/audio/20388aea_1708276953040.mp3?tenant=moj&referrer=audio-service&f=33d5318_26f/audio/20388aea_1708276953040.mp3, प्रेम प्रेम प्रेम प्रेम प्रेम प्रेम प्रेम प्रेम प्रेम प्रेम प्रेम प्रेम प्रेम प्रेम प्रेम प्रेम प्रेम प्रेम प्रेम प्रेम प्रेम प्रेम प्रेम प्रेम प्रेम प्रेम प्रेम प्रेम प्रेम प्रेम प्रेम प्रेम प्रेम प्रेम प्रेम प्रेम प्रेम �,Prem love love love love love love love love love love love love love love love love love love love love love love love love love love love love love love love love love love,Prem love love love love love love love love love love love love love love love love love love love love love love love love love love love love love love love love love
5.6K,2,747,poster,https://cdn4.sharechat.com/29623516_1664189055500.mp3?tenant=moj&referrer=audio-service&f=29623516_1664189055500.mp3, ना जमी होगी ना तू जगन होगा बदलें हर मौतम इन हवाओं में महची पिजाओं में शामिल रहेंगे हम,"Neither will you be frozen nor you will change every death, we will be involved in Mahachi Pizas in these winds","Neither will you be frozen nor you will change every death, we will be involved in Mahachi Pizas in these winds"
135.8K,163,14.1K,❤️❤️❤️❤️❤️,https://cdn4.sharechat.com/2f3f277f_1662369783883.mp3?tenant=moj&referrer=audio-service&f=2f3f277f_1662369783883.mp3," तुना जो कवेत मेरी ना से, हाँ � جो कवेत मेरी हाँ से, जिसकीन बात कोई ठाल को नहीं सकता हूँ, और कोई कोई मेरी मा से, मेरी मा मेरा रब, मेरी मा मेरा रब","Tuni Jo Kavet Meri Na, yes","Tuni Jo Kavet Meri Na, yes"
