Likes,Comments,Shares,Content,Audio URL,Transcription,English,
79.9K,58,12.3K,poster,https://cdn4.sharechat.com/33d5318_26f/audio/312afdd6_1725833776067.mp3?tenant=moj&referrer=audio-service&f=33d5318_26f/audio/312afdd6_1725833776067.mp3," सुनो, सच बोलकर दिल तोड़ देना, पर जूट बोलकर कभी धूका मत देना.","Listen, break your heart by telling the truth, but never smoke by speaking jute.","Listen, break your heart by telling the truth, but never smoke by speaking jute."
26.9K,22,7.4K,poster,https://cdn4.sharechat.com/33d5318_26f/audio/114ec0ae_1732977261254.mp3?tenant=moj&referrer=audio-service&f=33d5318_26f/audio/114ec0ae_1732977261254.mp3, क्या फाइदा देने प्यार करने का जब तुम्हारे पास मेरे लिए टाइम ही नहीं है,Do you not have time for me to love,Do you not have time for me to love
15.6K,8,2.8K,poster,https://cdn4.sharechat.com/12eaf22d_1665459547867.mp3?tenant=moj&referrer=audio-service&f=12eaf22d_1665459547867.mp3, पता है मजबूर हूँ मैं अपनी परिशानियों से और तुम समझते हो कि मैं बदल गई हूँ,Know that I am compelled by my affiliates and you understand that I am changed,Know that I am compelled by my affiliates and you understand that I am changed
2.7K,3,181,poster,https://cdn4.sharechat.com/33d5318_26f/audio/246950c8_1731664995859.mp3?tenant=moj&referrer=audio-service&f=33d5318_26f/audio/246950c8_1731664995859.mp3, दूसरों से क्या उमीद रखूँ? मैं तो अपने घरवालों को भी नहीं पसंद।,What should I expect from others?I do not even like my family members.,What should I expect from others?I do not even like my family members.
24.9K,32,6.6K,like karo follow karo comment karo share karo ♥️🥰😄😃😄😄😁,https://cdn4.sharechat.com/33d5318_26f/audio/3914d28b_1730700700893.mp3?tenant=moj&referrer=audio-service&f=33d5318_26f/audio/3914d28b_1730700700893.mp3, पहले मैंने प्यार न करने की कसम खाई थी पर जब से आपको देखा है कसम मसम जाय भाड में और हम पढ़ गए आपके प्यार में,"Earlier I vowed not to love but ever since I saw you in the morning, we have read and we have read in your love","Earlier I vowed not to love but ever since I saw you in the morning, we have read and we have read in your love"
1.8K,Comment,320,poster,https://cdn4.sharechat.com/1f57b02_1704394886916.mp3?tenant=moj&referrer=audio-service&f=1f57b02_1704394886916.mp3, किसे ने मुझे सबोचा आपकी दिल के सबसे करेब कौन है? मैंने भी कर दिया सेफडे,Who is the most of the heart of your heart?I also made safde,Who is the most of the heart of your heart?I also made safde
3.7K,7,555,poster,https://cdn4.sharechat.com/31866865_1707347553102.mp3?tenant=moj&referrer=audio-service&f=31866865_1707347553102.mp3," सुनो, हम लड़कियां दिल दुखने पर रातों को सडको पर नहीं फिर सकती, हम अपना दर्ज सिगरट के धूए में नहीं उडा सकती, हम अपना गुसा तुमारी तरह घरवालों पर भी नहीं उतार सकती, हमें तो रोने के लिए भी रात का इंतजार करना पड़ता है, ताके","Listen, we girls cannot take the nights on the roads when they are hurting, we cannot fly our recorded cigarette, we cannot even take off our guilty on the family members, we have to wait for the night to cry even to cry,","Listen, we girls cannot take the nights on the roads when they are hurting, we cannot fly our recorded cigarette, we cannot even take off our guilty on the family members, we have to wait for the night to cry even to cry,"
442.4K,412,74.8K,#pata hai ladki ladkon se kyon chhoti hoti hai #₹va #tending+tendin #va😻 #---va,https://cdn4.sharechat.com/33d5318_26f/audio/10909ac8_1728060653021.mp3?tenant=moj&referrer=audio-service&f=33d5318_26f/audio/10909ac8_1728060653021.mp3, पता है लड़कियां लड़कों से लंबाई में छोटी की होती हैं क्योंकि जब लड़का उसे गले लगाए ना तो लड़की उसकी दिल की धड़कन को सुन सके,"You know that girls are short in length than boys because when the boy hugs him, the girl can listen to his heartbeat","You know that girls are short in length than boys because when the boy hugs him, the girl can listen to his heartbeat"
115.8K,33,6.8K,caring wife 🥰,https://cdn4.sharechat.com/33d5318_26f/audio/1d459c2c_1732195914000.mp3?tenant=moj&referrer=audio-service&f=33d5318_26f/audio/1d459c2c_1732195914000.mp3, तुम्हें तो जगा रखना खुशी तुम्हारी है जब इसी में तो हम भी आसू छुपा ही लेंगे वजा जो पूछेगा ये जमाना कोई बहाना बना ही लेंगे चाहे जो तु पाए वो तुम्हें मेरी परियाग,"It is your happiness to keep you awake, when it is in this, we will also hide the Asu, who will ask, this era will make an excuse, no matter what you can","It is your happiness to keep you awake, when it is in this, we will also hide the Asu, who will ask, this era will make an excuse, no matter what you can"
188.2K,107,13.3K,ऊपर वाले से चालाकी नहीं 😂 ||#vira || #moj,https://cdn4.sharechat.com/33d5318_26f/audio/2926cab8_1730650462139.mp3?tenant=moj&referrer=audio-service&f=33d5318_26f/audio/2926cab8_1730650462139.mp3, ये उपर वाले दो तीन करोड रुपे उधार दे दे अरे उपर आके गैरेंटी के साथ आपको लुटा देंगे उपर आके लेले पैसे तियारे कम डियर,"These two to three crores rupees will lend the above, come up and come up and loot you with Garrenti","These two to three crores rupees will lend the above, come up and come up and loot you with Garrenti"
42.2K,55,15.1K,#yaad #♥️😔😔,https://cdn4.sharechat.com/1b685eb0_1610780283380.mp3?tenant=moj&referrer=audio-service&f=1b685eb0_1610780283380.mp3," इस उजड़े चमन में फूल खिलाएगा कौन, हमारे बाद तुम्हे इतना याद आएगा कौन, अरे पगले आज हम हैं तभी तो सताते हैं, हमारे जाने की बाद तुम्हे इतना सताएगा कौन","Who will feed flowers in this desolate chaman, after us, you will miss so much, oh Pagle today, only then we persecute you, who will be so persecuted to go after us","Who will feed flowers in this desolate chaman, after us, you will miss so much, oh Pagle today, only then we persecute you, who will be so persecuted to go after us"
141K,101,20.1K,poster,https://cdn4.sharechat.com/33d5318_26f/audio/3b17db2d_1725066981257.mp3?tenant=moj&referrer=audio-service&f=33d5318_26f/audio/3b17db2d_1725066981257.mp3," पल पल तरपे जिस पल के लिए, वो पल भी आया, कुछ पल के लिए, सोचा उस पल को रोक लूँ हर पल के लिए, पर वो पल भी ठहरा, कुछ पल के लिए","For the moment when the moment came, that moment also came, for a few moments, I thought I should stop that moment for every moment, but that moment is also there, for a few moments",
78K,64,9.7K,👉sahi bat hai 👈,https://cdn4.sharechat.com/33d5318_26f/audio/f12ff2e_1734069815389.mp3?tenant=moj&referrer=audio-service&f=33d5318_26f/audio/f12ff2e_1734069815389.mp3, जितना सरीप बनोगी दुनिया उतना ही सताएगी हरामी बनकर जीओ दुनिया सलाम ठोकके जाएगी,"The more Sarip will become the world, the more you will persecute the world, the world will be saluted.","The more Sarip will become the world, the more you will persecute the world, the world will be saluted."
3.7K,15,267,poster,https://cdn4.sharechat.com/33d5318_26f/audio/1243d5f5_1718512327115.mp3?tenant=moj&referrer=audio-service&f=33d5318_26f/audio/1243d5f5_1718512327115.mp3, छोटा सा तु मेरा एक काम कर दे तेरा सरने मेरे नाम कर दे,"You should do one thing, you will make your surname in my name","You should do one thing, you will make your surname in my name"
29.3K,86,2K,poster,https://cdn4.sharechat.com/33d5318_26f/audio/dee4591_1730643194565.mp3?tenant=moj&referrer=audio-service&f=33d5318_26f/audio/dee4591_1730643194565.mp3, पेरी गैर सुबा मेरी तूए शाम ये,Peri non -Suba Meri Tuaye Sham This,Peri non -Suba Meri Tuaye Sham This
47.9K,26,1.5K,poster,https://cdn4.sharechat.com/33d5318_26f/audio/2f7cfe5e_1733981253352.mp3?tenant=moj&referrer=audio-service&f=33d5318_26f/audio/2f7cfe5e_1733981253352.mp3," तुम मुश्कुराता हूँ क्या हुआ? मी तनहाई को के भूल जाता हूँ तुम मिलता है मुझे मैडम, आपके जैसे हजारों स्टुडेंट्स को रोस्ट करने का एक्सपिरियन्स रह चुका है भूल जाता हूँ ए, ज़रा मैडम को वास्ट्रूम का रस्ता तो दिखा",What happened to you?I forget me Tanhai.,What happened to you?I forget me Tanhai.
11.1K,19,1.3K,poster,https://cdn4.sharechat.com/33d5318_26f/audio/12b09562_1734108148968.mp3?tenant=moj&referrer=audio-service&f=33d5318_26f/audio/12b09562_1734108148968.mp3, जितना सरीब बनोगी दुनिया उतना ही सताएगी हरामी बनकर जीओ दुनिया सलाम ठोकके जाएगी,"The more the world, the more the world will persecute the world, live the world, the world will be saluted.","The more the world, the more the world will persecute the world, live the world, the world will be saluted."
19.1K,17,2.4K,poster,https://cdn4.sharechat.com/33d5318_26f/audio/33211a53_1730183870132.mp3?tenant=moj&referrer=audio-service&f=33d5318_26f/audio/33211a53_1730183870132.mp3, गलत थी मैं जो तुझको तेरी ओकात से ज़्यादा चाहा था एक तुझको पाने की घातर दुनिया को ठुकराया था,"I was wrong, who had wanted you more than your utterance, had rejected the ambush world to get you","I was wrong, who had wanted you more than your utterance, had rejected the ambush world to get you"
4.6K,6,379,poster,https://cdn4.sharechat.com/2faae0bf_1654411033282.mp3?tenant=moj&referrer=audio-service&f=2faae0bf_1654411033282.mp3, जीने की खौईश ना मरने का खौब The number you are calling is currently switched off,Living is not a dying of life. The number you are calling is currently switched off,Living is not a dying of life. The number you are calling is currently switched off
14.6K,36,3.3K,poster,https://cdn4.sharechat.com/33d5318_26f/audio/9fd9a16_1730425330240.mp3?tenant=moj&referrer=audio-service&f=33d5318_26f/audio/9fd9a16_1730425330240.mp3, प्रश्न प्रश्न,Question question,Question question
19.1K,53,2.3K,poster,https://cdn4.sharechat.com/19538553_1703554935575.mp3?tenant=moj&referrer=audio-service&f=19538553_1703554935575.mp3, मैंने छोड़े हैं बाकी सारे रास्ते हैं बस आया हूँ तेरे पास रे मेरी आँखों में तेरा नाम है पहचान ले सब कुछ मेरे लिए तेरे बात है सौ बातों की,"I have left all the other ways, I have come to you, I have your name in my eyes, I recognize everything for me","I have left all the other ways, I have come to you, I have your name in my eyes, I recognize everything for me"
29.2K,25,7.6K,Cute Couple😍👩‍❤️‍💋‍👨 LOVE status video❤️ Whatsapp Status video♥️😘 Love Zone #shorts#couplegoals#Viral#shortsvideo #viralreels #trending #couplesvideo #explorerpage,https://cdn4.sharechat.com/33d5318_26f/audio/331329d_1730767846120.mp3?tenant=moj&referrer=audio-service&f=33d5318_26f/audio/331329d_1730767846120.mp3, तू हजार बार भी रूठे तो मैं मना लूँगी बस जगडे में कोई तीसरा शामिल लाओ,"If you are angry with a thousand times, I will convince, just bring a third one in the world","If you are angry with a thousand times, I will celebrate, just bring a third one in the world"
1.8K,Comment,158,poster,https://cdn4.sharechat.com/33d5318_26f/audio/3d4d350_1733918733684.mp3?tenant=moj&referrer=audio-service&f=33d5318_26f/audio/3d4d350_1733918733684.mp3, अच्छा एक बात बताओ हुँ सबसे आदा स्क्रॉंग कौन होता है? लड़की या लड़के? लड़के कैसे? हज़ार बार गिडने के बाद भी खुछ से खड़े हो जाते हैं लड़के क्योंकि उन्हें पता है उन्हें उठाने कोई नहीं आएगा,"Okay, tell me one thing, who is the most unlikely scrong?Girl or boy?How did boys?Boys stand up with a thousand times even after being giddy, because they know no one will come to lift them","Okay, tell me one thing, who is the most unlikely scrong?Girl or boy?How did boys?Boys stand up with a thousand times even after being giddy, because they know no one will come to lift them"
4.6K,28,237,🫣,https://cdn4.sharechat.com/33d5318_26f/audio/c3ab09a_1730684661895.mp3?tenant=moj&referrer=audio-service&f=33d5318_26f/audio/c3ab09a_1730684661895.mp3, कब मामी डैडी मेरे तू पटाएगा लेके बैंड बाजा घर मेरे आएगा कब तक मुझे ऐसे ही गुमाएगा तू बात बढ़ा तो सही,"When Mami Daddy will beat me, but the band Baja house will come to me, how long will you get like this, then you will increase the matter, then right","When Mami Daddy will beat me, but the band Baja house will come to me, how long will you get like this, then you will increase the matter, then right"
